{
  "schema_version": 1,
  "delivery_id": "9b2c3d4e-1111-11e3-81ab-4c9367dc0958",
  "event": "pull_request",
  "action": "opened",
  "type": "pull_request.opened",
  "occurred_at": "2026-09-27T12:05:00Z",
  "correlation_id": "corr-pr-opened-0001",
  "installation": { "github_id": 12345678 },
  "repository": { "github_id": 87654321, "full_name": "example-org/example.repo_2", "private": true, "default_branch": "main" },
  "actor": { "login": "dependabot[bot]" },
  "pull_request": {
    "number": 42, "state": "open", "draft": false, "merged": false,
    "head_sha": "bbbbbbbbbbbbbbbbbbbbbbbbbbbbbbbbbbbbbbbb", "base_sha": "aaaaaaaaaaaaaaaaaaaaaaaaaaaaaaaaaaaaaaaa", "head_ref": "feature/login", "base_ref": "main",
    "changed_files": 7, "additions": 120, "deletions": 15
  }
}
