{
  "schema_version": 1,
  "delivery_id": "72d3162e-cc78-11e3-81ab-4c9367dc0958",
  "event": "push",
  "action": null,
  "type": "push",
  "occurred_at": "2026-09-27T12:00:00Z",
  "correlation_id": "0f1e2d3c4b5a69788796a5b4c3d2e1f0",
  "installation": { "github_id": 12345678 },
  "repository": { "github_id": 87654321, "full_name": "example-org/example-repo", "private": false, "default_branch": "main" },
  "actor": { "login": "octo-dev" },
  "push": { "ref": "refs/heads/main", "before": "aaaaaaaaaaaaaaaaaaaaaaaaaaaaaaaaaaaaaaaa", "after": "bbbbbbbbbbbbbbbbbbbbbbbbbbbbbbbbbbbbbbbb", "commit_count": 3, "created": false, "deleted": false, "forced": false }
}
